{
  "schema_version": 1,
  "kind": "forum.thread",
  "data": [
    {
      "id": "1",
      "subject": "第一次作業的常見問題",
      "message": "<p>交件前請先看評分標準。</p>",
      "message_format": 1,
      "author": "Tammy Teacher",
      "parent_id": null,
      "created_at": "2026-09-18T09:33:34Z",
      "deleted": false,
      "attachments": [],
      "url": "http://localhost:8511/mod/forum/discuss.php?d=1#p1"
    },
    {
      "id": "2",
      "subject": "Re: 第一次作業的常見問題",
      "message": "<p>請問可以交 PDF 以外的格式嗎？</p>",
      "message_format": 1,
      "author": "Sam Student",
      "parent_id": "1",
      "created_at": "2026-09-18T09:33:34Z",
      "deleted": false,
      "attachments": [],
      "url": "http://localhost:8511/mod/forum/discuss.php?d=1#p2"
    }
  ],
  "meta": {
    "site": "rec",
    "account": "env",
    "source": "ws",
    "partial": false,
    "missing": [],
    "next_cursor": null
  }
}
